{
  "name": "R-dev pilot r3 (fixture)",
  "kind": "evidence-read",
  "rubric_sha256": "2e11f3688de916da8bfc8b5b0a788050bf9d077960d616d33490c6ecf747363b",
  "order_seed": 4242,
  "readers": [
    "areader",
    "breader"
  ],
  "tasks": [
    {
      "pair_id": "2016_1__3797929",
      "stratum": "model_positive",
      "question": {
        "id": "2016_1",
        "type": "diagnosis",
        "summary": "A 78 year old male presents with frequent stools and melena.",
        "description": "78 M transferred to nursing home for rehab after CABG. Reportedly readmitted with a small NQWMI. Yesterday, he was noted to have a melanotic stool and then today he had approximately 9 loose BM w/ some melena and some frank blood just prior to transfer, unclear quantity."
      },
      "document": {
        "doc_id": "3797929",
        "title": "Lower Gastrointestinal Bleeding: Is Urgent Colonoscopy Necessary for All Hematochezia?",
        "units": [
          {
            "index": 0,
            "title": "Abstract",
            "sentences": [
              {
                "i": 0,
                "text": "Lower Gastrointestinal Bleeding: Is Urgent Colonoscopy Necessary for All Hematochezia?"
              },
              {
                "i": 1,
                "text": "Lower gastrointestinal bleeding (LGIB) is defined as acute or chronic abnormal blood loss distal to the ligament of Treitz."
              },
              {
                "i": 2,
                "text": "The incidence of LGIB is only one fifth of that of the upper gastrointestinal tract and is estimated to be 21 to 27 cases per 100,000 adults per year."
              },
              {
                "i": 3,
                "text": "Acute bleeding is arbitrarily defined as bleeding of <3 days' duration resulting in instability of vital signs, anemia, and/or need for blood transfusion."
              },
              {
                "i": 4,
                "text": "Chronic bleeding is defined as slow blood loss over a period of several days or longer presenting with symptoms of occult fecal blood, intermittent melena, or scant hematochezia."
              },
              {
                "i": 5,
                "text": "Bleeding means that the amounts of blood in the feces are too small to be seen but detectable by chemical tests."
              },
              {
                "i": 6,
                "text": "LGIB is usually chronic and stops spontaneously."
              },
              {
                "i": 7,
                "text": "Bleeding stop (80%), but male gender and older patients suffer from more severe LGIB."
              },
              {
                "i": 8,
                "text": "The optimal timing of colonoscopic intervention for LGIB remains uncertain."
              }
            ]
          }
        ]
      },
      "claims": [
        {
          "set_index": 1,
          "spans": [
            {
              "unit": 0,
              "first_sentence": 3,
              "last_sentence": 7,
              "text": "Acute bleeding is arbitrarily defined as bleeding of <3 days' duration resulting in instability of vital signs, anemia, and/or need for blood transfusion. Chronic bleeding is defined as slow blood loss over a period of several days or longer presenting with symptoms of occult fecal blood, intermittent melena, or scant hematochezia. Bleeding means that the amounts of blood in the feces are too small to be seen but detectable by chemical tests. LGIB is usually chronic and stops spontaneously. Bleeding stop (80%), but male gender and older patients suffer from more severe LGIB."
            }
          ],
          "sources": [
            "scout"
          ]
        },
        {
          "set_index": 2,
          "spans": [
            {
              "unit": 0,
              "first_sentence": 4,
              "last_sentence": 4,
              "text": "Chronic bleeding is defined as slow blood loss over a period of several days or longer presenting with symptoms of occult fecal blood, intermittent melena, or scant hematochezia."
            }
          ],
          "sources": [
            "qwen"
          ]
        }
      ],
      "extra_questions": []
    },
    {
      "pair_id": "2016_13__3844363",
      "stratum": "model_negative",
      "question": {
        "id": "2016_13",
        "type": "test",
        "summary": "A 43 year old woman with history of transverse myelitis leading to paraplegia, depression, frequent pressure ulcers, presenting with chills, agitation, rigors, and back pain.  Patient has stage IV decubitus ulcers on coccyx and buttocks, heels.  Admission labs significant for thrombocytosis, elevated lactate, and prolonged PT.",
        "description": "A 43 year old woman with history of transverse myelitis leading to paraplegia, depression, frequent pressure ulcers, presenting with chills and reporting she felt \"as if dying\". Upon presentation, she denied any shortness of breath, nausea, vomiting, but did report diarrhea with two loose bowel movements per day. Patient reported that she had a fallout with her VNA and has not had any professional wound care.  Patient is agitated, with rigors, complaining of feeling cold and back pain. Patient rolled and found to have a stage IV decubitus ulcer on coccyx and buttocks, heels. Admission labs significant for thrombocytosis,  elevated lactate, and prolonged PT."
      },
      "document": {
        "doc_id": "3844363",
        "title": "Prevention of pressure ulcers at orthopaedic patients begins on the accident and emergency department",
        "units": [
          {
            "index": 0,
            "title": "Abstract",
            "sentences": [
              {
                "i": 0,
                "text": "Prevention of pressure ulcers at orthopaedic patients begins on the accident and emergency department"
              }
            ]
          }
        ]
      },
      "claims": [],
      "extra_questions": [
        {
          "id": "other_passage",
          "text": "Does a passage in this document, other than any claimed above, answer the question?",
          "answer_type": "yes-no"
        }
      ]
    }
  ]
}
